{
  "$schema": "https://json-schema.org/draft/2020-12/schema",
  "$id": "https://hakoniwa.dev/schemas/viewer-config.schema.json",
  "title": "Hakoniwa Threejs Viewer Config",
  "type": "object",
  "additionalProperties": false,
  "required": [
    "version",
    "three",
    "pdu",
    "stateInput"
  ],
  "properties": {
    "version": {
      "type": "string",
      "const": "1.0"
    },
    "three": {
      "type": "object",
      "additionalProperties": false,
      "required": [
        "sceneConfigPath"
      ],
      "properties": {
        "sceneConfigPath": {
          "type": "string",
          "minLength": 1
        },
        "transparentBackground": {
          "type": "boolean",
          "default": false
        },
        "droneAppearance": {
          "type": "object",
          "additionalProperties": false,
          "properties": {
            "bodyColor": {
              "type": "string",
              "pattern": "^#[0-9A-Fa-f]{6}$"
            }
          }
        },
        "initialCameraMode": {
          "type": "string",
          "enum": ["free", "audience"],
          "default": "free"
        },
        "audienceCamera": {
          "type": "object",
          "additionalProperties": false,
          "required": ["positionM", "yawDeg", "pitchDeg", "fovDeg"],
          "properties": {
            "positionM": {
              "type": "array",
              "minItems": 3,
              "maxItems": 3,
              "items": { "type": "number" }
            },
            "yawDeg": { "type": "number" },
            "pitchDeg": { "type": "number", "minimum": -85, "maximum": 85 },
            "fovDeg": { "type": "number", "minimum": 25, "maximum": 90 },
            "moveSpeedMps": { "type": "number", "exclusiveMinimum": 0, "maximum": 100 }
          }
        }
      }
    },
    "pdu": {
      "type": "object",
      "additionalProperties": false,
      "required": [
        "pduDefPath",
        "wsUri"
      ],
      "properties": {
        "pduDefPath": {
          "type": "string",
          "minLength": 1
        },
        "wsUri": {
          "type": "string",
          "minLength": 1
        },
        "wireVersion": {
          "type": "string",
          "default": "v2"
        }
      }
    },
    "ui": {
      "type": "object",
      "additionalProperties": false,
      "properties": {
        "statePanelIntervalMsec": {
          "type": "integer",
          "minimum": 1
        },
        "enableAttachedCameras": {
          "type": "boolean",
          "default": true
        },
        "enableMainCameraMouseControl": {
          "type": "boolean",
          "default": true
        },
        "attachedCameraPresentation": {
          "type": "string",
          "enum": ["overlay", "main"],
          "default": "overlay"
        },
        "initialMainView": {
          "type": "string",
          "enum": ["attached", "objective"],
          "default": "attached"
        },
        "overviewInset": {
          "type": "boolean",
          "default": false
        }
      }
    },
    "faultInjection": {
      "type": "object",
      "description": "Rotor fault and wind injection through the Drone disturbance PDU.",
      "additionalProperties": false,
      "required": ["robotName", "rotorCount"],
      "properties": {
        "robotName": {
          "type": "string",
          "minLength": 1
        },
        "pduName": {
          "type": "string",
          "minLength": 1,
          "default": "disturb"
        },
        "rotorCount": {
          "type": "integer",
          "minimum": 1,
          "maximum": 16
        }
      }
    },
    "flightPaths": {
      "type": "array",
      "description": "Planned Drone flight paths drawn on request (DroneViewer.setFlightPathsVisible). Points are Urban ENU metres: the scene's X = east_m, Y = up_m, Z = -north_m.",
      "items": {
        "type": "object",
        "required": ["points"],
        "properties": {
          "drone": { "type": "string" },
          "points": {
            "type": "array",
            "items": {
              "type": "object",
              "required": ["east_m", "north_m", "up_m"],
              "properties": {
                "east_m": { "type": "number" },
                "north_m": { "type": "number" },
                "up_m": { "type": "number" },
                "kind": { "enum": ["takeoff", "waypoint", "land"] },
                "label": { "type": "string" },
                "name": { "type": "string" },
                "stand": { "type": "boolean" },
                "again": { "type": "boolean" }
              }
            }
          },
          "zones": {
            "type": "array",
            "description": "Where wind blows or rotors fail along the path: see-through boxes (cyan wind, red fault). corners are 8 Urban ENU points [east_m, north_m, up_m]: 0-3 the bottom face in order (a-left, a-right, b-right, b-left), 4-7 the top face above them.",
            "items": {
              "type": "object",
              "required": ["corners"],
              "anyOf": [{ "required": ["wind"] }, { "required": ["fault"] }],
              "properties": {
                "label": { "type": "string" },
                "corners": {
                  "type": "array",
                  "minItems": 8,
                  "maxItems": 8,
                  "items": {
                    "type": "array",
                    "minItems": 3,
                    "maxItems": 3,
                    "items": { "type": "number" }
                  }
                },
                "wind": {
                  "type": "object",
                  "required": ["towards_deg", "speed_m_s"],
                  "description": "towards_deg: where the wind blows towards, east 0, counter-clockwise (north 90).",
                  "properties": {
                    "towards_deg": { "type": "number" },
                    "speed_m_s": { "type": "number", "minimum": 0 }
                  }
                },
                "fault": {
                  "type": "object",
                  "required": ["rotors", "scale"],
                  "properties": {
                    "rotors": { "type": "array", "items": { "type": "integer", "minimum": 0 } },
                    "scale": { "type": "number", "minimum": 0 }
                  }
                }
              }
            }
          }
        }
      }
    },
    "routePaths": {
      "type": "array",
      "description": "Planned vehicle routes drawn with the flight paths (DroneViewer.setPlannedPathsVisible): points in Urban ENU metres, dense enough to follow the ground (bridges, slopes).",
      "items": {
        "type": "object",
        "required": ["points"],
        "properties": {
          "route": { "type": "string" },
          "vehicles": { "type": "array", "items": { "type": "string" } },
          "closed": { "type": "boolean" },
          "points": {
            "type": "array",
            "items": {
              "type": "object",
              "required": ["east_m", "north_m", "up_m"],
              "properties": {
                "east_m": { "type": "number" },
                "north_m": { "type": "number" },
                "up_m": { "type": "number" },
                "road_friction": {
                  "type": "number", "minimum": 0,
                  "description": "The road's friction from this point on; the line is coloured by it (dry, wet, snow, ice)."
                },
                "road_width_m": {
                  "type": "number", "exclusiveMinimum": 0,
                  "description": "The width of the band where road_friction holds, drawn see-through in its colour."
                }
              }
            }
          }
        }
      }
    },
    "stateInput": {
      "type": "object",
      "additionalProperties": false,
      "required": [
        "mode"
      ],
      "properties": {
        "mode": {
          "type": "string",
          "enum": [
            "legacy",
            "fleets",
            "none"
          ]
        },
        "legacy": {
          "type": "object",
          "additionalProperties": false,
          "required": [
            "roleMap"
          ],
          "properties": {
            "motorChannels": {
              "type": "array",
              "minItems": 1,
              "uniqueItems": true,
              "items": { "type": "integer", "minimum": 0 }
            },
            "rotorScale": {
              "type": "number",
              "exclusiveMinimum": 0
            },
            "roleMap": {
              "type": "object",
              "additionalProperties": false,
              "required": [
                "pos",
                "motor"
              ],
              "properties": {
                "pos": {
                  "type": "string",
                  "minLength": 1
                },
                "motor": {
                  "type": "string",
                  "minLength": 1
                }
              }
            }
          }
        },
        "fleets": {
          "type": "object",
          "additionalProperties": false,
          "required": [
            "roleMap"
          ],
          "properties": {
            "motorChannels": {
              "type": "array",
              "minItems": 1,
              "uniqueItems": true,
              "items": { "type": "integer", "minimum": 0 }
            },
            "rotorScale": {
              "type": "number",
              "exclusiveMinimum": 0
            },
            "dynamicSpawn": {
              "type": "boolean",
              "default": false
            },
            "templateDroneIndex": {
              "type": "integer",
              "minimum": 0,
              "default": 0
            },
            "maxDynamicDrones": {
              "type": "integer",
              "minimum": 1
            },
            "interpolation": {
              "type": "object",
              "additionalProperties": false,
              "properties": {
                "enabled": { "type": "boolean", "default": false },
                "periodMsec": { "type": "number", "exclusiveMinimum": 0 },
                "delayMsec": { "type": "number", "minimum": 0 },
                "snapDistanceM": { "type": "number", "exclusiveMinimum": 0, "default": 2.0 }
              }
            },
            "roleMap": {
              "type": "object",
              "additionalProperties": false,
              "required": [
                "visual_state_array"
              ],
              "properties": {
                "visual_state_array": {
                  "type": "string",
                  "minLength": 1
                }
              }
            }
          }
        },
        "vehicles": {
          "type": "object",
          "additionalProperties": false,
          "required": ["roleMap"],
          "properties": {
            "interpolation": {
              "type": "object",
              "additionalProperties": false,
              "properties": {
                "enabled": { "type": "boolean", "default": false },
                "periodMsec": { "type": "number", "exclusiveMinimum": 0 },
                "delayMsec": { "type": "number", "minimum": 0 },
                "snapDistanceM": { "type": "number", "exclusiveMinimum": 0, "default": 2.0 }
              }
            },
            "roleMap": {
              "type": "object",
              "additionalProperties": false,
              "required": ["vehicle_states", "joint_states"],
              "properties": {
                "vehicle_states": {
                  "type": "string",
                  "const": "sensor_msgs/MultiDOFJointState"
                },
                "joint_states": {
                  "type": "string",
                  "const": "sensor_msgs/JointState"
                }
              }
            }
          }
        }
      },
      "allOf": [
        {
          "if": {
            "properties": {
              "mode": {
                "const": "legacy"
              }
            }
          },
          "then": {
            "required": [
              "legacy"
            ]
          }
        },
        {
          "if": {
            "properties": {
              "mode": {
                "const": "fleets"
              }
            }
          },
          "then": {
            "required": [
              "fleets"
            ]
          }
        }
      ]
    }
  },
  "allOf": [
    {
      "if": {
        "properties": {
          "stateInput": {
            "properties": {
              "mode": {
                "const": "fleets"
              }
            }
          }
        }
      },
      "then": {
        "properties": {
          "pdu": {
            "required": [
              "wireVersion"
            ],
            "properties": {
              "wireVersion": {
                "const": "v2"
              }
            }
          }
        }
      }
    },
    {
      "if": {
        "properties": {
          "stateInput": { "required": ["vehicles"] }
        }
      },
      "then": {
        "properties": {
          "pdu": {
            "required": ["wireVersion"],
            "properties": { "wireVersion": { "const": "v2" } }
          }
        }
      }
    }
  ]
}
