{
  "version": "1.0",
  "three": {
    "sceneConfigPath": "./drone_config-compact-hexa-eams-1.json"
  },
  "pdu": {
    "pduDefPath": "./pdudef-fleets.json",
    "wsUri": "ws://127.0.0.1:8765",
    "wireVersion": "v2"
  },
  "ui": {
    "statePanelIntervalMsec": 100,
    "enableAttachedCameras": false,
    "enableMainCameraMouseControl": true
  },
  "stateInput": {
    "mode": "fleets",
    "fleets": {
      "motorChannels": [0, 1, 2, 3, 4, 5],
      "rotorScale": 200.0,
      "roleMap": {
        "visual_state_array": "hako_msgs/DroneVisualStateArray"
      }
    }
  }
}
